{
  "$schema": "https://raw.githubusercontent.com/wilanis/wilanis-js/main/packages/core/schemas/trigger.schema.json",
  "label": "DELETE /monitor",
  "description": "DELETE /monitor with a body of ids \u2192 the entries that were removed, in the order asked. Every deletion is issued at once, paced by the connection's throttle, and the answer leaves only after the last one settled; one entry that does not exist refuses the whole request as missing (404). Employees holding the recorder role only: 401 as anonymous without a token or as invalid_credential with a bad one, 403 as forbidden for a customer or an employee without the role.",
  "settings": {
    "route": "/monitor",
    "method": "DELETE",
    "consumes": "application/json",
    "produces": "application/json",
    "body": "@monitor/edge/DeleteRequest.shape.json",
    "response": {
      "refusals": {
        "missing": 404,
        "upstream": 502,
        "anonymous": 401,
        "invalid_credential": 401,
        "forbidden": 403,
        "invariant": 500
      }
    }
  },
  "in": "@monitor/edge/DeleteRequest.shape.json",
  "out": "@monitor/edge/EntryView.shape.json[]",
  "policies": [
    {
      "policy": "@access/edge/employees-only.policy.json",
      "in": {
        "token": [
          "{{request.headers.authorization}}",
          "{{request.cookies.session}}"
        ]
      }
    },
    "@access/edge/can-record.policy.json"
  ],
  "kind": "@http/http.trigger-kind.json",
  "fire": {
    "run": "@monitor/domain/monitor.port.json#removeMany",
    "in": {
      "ids": "{{request.body.ids}}"
    }
  }
}
