{
  "$schema": "https://raw.githubusercontent.com/wilanis/wilanis-js/main/packages/core/schemas/trigger.schema.json",
  "label": "PUT /customers/{id}",
  "description": "PUT /customers/{id}: the id from the route, who the customer now is from the body → the customer; 404 as missing when there is none, 409 as conflict when another customer holds the address, 500 as invariant when who they now are is not a customer this tree keeps (a gold customer without a note), 502 as upstream when the customer API broke. Employees holding the registrar role only: 401 as anonymous without a token or as invalid_credential with a bad one, 403 as forbidden for a customer or an employee without the role.",
  "settings": {
    "route": "/customers/{id}",
    "method": "PUT",
    "consumes": "application/json",
    "produces": "application/json",
    "body": "@customers/edge/UpdateBody.shape.json",
    "response": {
      "refusals": {
        "missing": 404,
        "upstream": 502,
        "anonymous": 401,
        "invalid_credential": 401,
        "forbidden": 403,
        "invariant": 500,
        "conflict": 409
      }
    }
  },
  "in": "@customers/edge/UpdateRequest.shape.json",
  "out": "@customers/edge/CustomerView.shape.json",
  "policies": [
    {
      "policy": "@access/edge/employees-only.policy.json",
      "in": {
        "token": [
          "{{context.headers.authorization}}",
          "{{context.cookies.session}}"
        ]
      }
    },
    "@access/edge/can-register.policy.json"
  ],
  "kind": "@http/http.trigger-kind.json",
  "fire": {
    "run": "@customers/domain/customer.port.json#update",
    "in": {
      "id": "{{context.params.id}}",
      "name": "{{context.body.name}}",
      "email": "{{context.body.email}}",
      "tier": "{{context.body.tier}}",
      "note": "{{context.body.note}}"
    }
  }
}
