{
  "$schema": "https://raw.githubusercontent.com/wilanis/wilanis-js/main/packages/core/schemas/trigger.schema.json",
  "label": "DELETE /customers",
  "description": "DELETE /customers with a body of ids \u2192 the customers that were removed, in the order asked. At most a hundred ids (400 past that, before anything runs); the deletions run eight at a time, paced further by the connection's throttle, and the answer leaves only after the last one settled; one customer that does not exist refuses the whole request as missing (404). Employees holding the registrar role only: 401 as anonymous without a token or as invalid_credential with a bad one, 403 as forbidden for a customer or an employee without the role.",
  "settings": {
    "route": "/customers",
    "method": "DELETE",
    "consumes": "application/json",
    "produces": "application/json",
    "body": "@customers/edge/DeleteRequest.shape.json",
    "response": {
      "refusals": {
        "missing": 404,
        "upstream": 502,
        "anonymous": 401,
        "invalid_credential": 401,
        "forbidden": 403,
        "invariant": 500
      }
    }
  },
  "in": "@customers/edge/DeleteRequest.shape.json",
  "out": "@customers/edge/CustomerView.shape.json[]",
  "policies": [
    {
      "policy": "@access/edge/employees-only.policy.json",
      "in": {
        "token": [
          "{{context.headers.authorization}}",
          "{{context.cookies.session}}"
        ]
      }
    },
    "@access/edge/can-register.policy.json"
  ],
  "kind": "@http/http.trigger-kind.json",
  "fire": {
    "run": "@customers/domain/customer.port.json#removeMany",
    "in": {
      "ids": "{{context.body.ids}}"
    }
  }
}
