{
  "$schema": "https://raw.githubusercontent.com/wilanis/wilanis-js/main/packages/core/schemas/trigger.schema.json",
  "label": "GET /monitor/{id}",
  "description": "GET /monitor/{id} \u2192 the entry; 404 { reason: missing, message: `no entry {id}` } when there is none, 502 as upstream when the monitor API broke.",
  "settings": {
    "route": "/monitor/{id}",
    "method": "GET",
    "produces": "application/json",
    "response": {
      "refusals": {
        "missing": 404,
        "upstream": 502,
        "invariant": 500
      }
    }
  },
  "in": "@monitor/edge/IdRequest.shape.json",
  "out": "@monitor/edge/EntryView.shape.json",
  "kind": "@http/http.trigger-kind.json",
  "fire": {
    "run": "@monitor/domain/monitor.port.json#get",
    "in": {
      "id": "{{request.params.id}}"
    }
  }
}
